{
  "$schema": "../schemas/equipment_set.schema.json",
  "schemaVersion": 1,
  "verified": false,
  "notes": [
    "Промывочное устройство (п. 6.7.1.15 СП 485): DN — по норме из data/norms (не менее DN 50, при меньшей трубе — DN трубы). Состав — кран с заглушкой; допускаются заглушка или фланец — решение проектировщика."
  ],
  "items": [
    {
      "name": "Кран шаровой DN{dn}, PN 16",
      "unit": "шт.",
      "per": 1,
      "note": "промывочный; или аналог",
      "designation": "ГОСТ 21345-2005"
    },
    {
      "name": "Заглушка резьбовая DN{dn}",
      "unit": "шт.",
      "per": 1,
      "note": "на промывочный кран",
      "designation": "ГОСТ 8962-75"
    }
  ]
}
